{
  "$schema": "./prd.schema.json",
  "schema_version": "1.0.0",
  "project": "Ralph Audit Golden Template",
  "defaults": {
    "mode_default": "audit",
    "max_stories_default": "all_open",
    "model_default": "gpt-5.3",
    "reasoning_effort_default": "high",
    "report_dir": ".codex/ralph-audit/audit",
    "sandbox_by_mode": {
      "audit": "read-only",
      "linting": "read-only",
      "fixing": "workspace-write"
    },
    "lint_detection_order": [
      "package.json scripts (lint/test)",
      "pyproject/requirements (ruff/pytest)",
      "go.mod (go test ./...)",
      "Cargo.toml (cargo test)",
      "Makefile targets (make lint/test)"
    ]
  },
  "stories": [
    {
      "id": "AUDIT-001",
      "title": "Repository Inventory And Operational Surface",
      "priority": 1,
      "mode": "audit",
      "scope": [
        "**/*",
        "!**/.git/**",
        "!**/node_modules/**",
        "!**/vendor/**"
      ],
      "acceptance_criteria": [
        "Created .codex/ralph-audit/audit/AUDIT-001-repository-inventory.md with repository inventory findings",
        "Report summarizes high-level structure, critical entry points, and unknown areas",
        "Report includes concrete evidence paths and risk notes"
      ],
      "passes": false,
      "notes": "Passive audit only. No code changes. Detailed execution plan is defined via objective/steps/verification/out_of_scope.",
      "objective": "Run an iterative, evidence-first deep audit for 'Repository Inventory And Operational Surface' using small scan passes and severity-based triage.",
      "steps": [
        {
          "id": "S01",
          "title": "Preflight: Scope and boundaries",
          "actions": [
            "Confirm active story AUDIT-001 and repository-relative scope boundaries.",
            "Limit inspection strictly to: **/*, !**/.git/**, !**/node_modules/**, !**/vendor/**."
          ],
          "expected_evidence": [
            "Scope-boundary statement in report method section.",
            "List of included/excluded areas for this pass."
          ],
          "done_when": [
            "Audit boundary is explicit and reproducible."
          ]
        },
        {
          "id": "S02",
          "title": "Inventory pass: Files and entry points",
          "actions": [
            "Enumerate repository structure and identify runtime/automation entry points.",
            "Capture unknown ownership or unclear operational zones for follow-up."
          ],
          "expected_evidence": [
            "Path-indexed inventory snapshot.",
            "Unknown/high-risk zone shortlist."
          ],
          "done_when": [
            "High-signal inspection targets are clearly identified."
          ]
        },
        {
          "id": "S03",
          "title": "Deep scan pass A: Broken logic and will-break patterns",
          "actions": [
            "Inspect line-by-line for broken logic, invalid assumptions, and fragile runtime behavior.",
            "Capture potential will-break issues with concrete path evidence."
          ],
          "expected_evidence": [
            "Finding candidates tagged as broken-logic/will-break.",
            "Evidence references with file paths and lines where possible."
          ],
          "done_when": [
            "All high-risk logic defects are captured or explicitly ruled out."
          ]
        },
        {
          "id": "S04",
          "title": "Deep scan pass B: Unfinished, stubs, skeleton code",
          "actions": [
            "Look for TODO/FIXME/HACK markers, placeholders, partial implementations, and fake/stub responses.",
            "Record incomplete behavior and latent feature gaps."
          ],
          "expected_evidence": [
            "Finding candidates tagged unfinished/stub/skeleton.",
            "Examples with code-location context."
          ],
          "done_when": [
            "Incomplete implementations are explicitly documented."
          ]
        },
        {
          "id": "S05",
          "title": "Deep scan pass C: Dead ends, slop, duplication",
          "actions": [
            "Identify dead code paths, orphaned exports/files, copy-paste duplication, and excessive complexity.",
            "Flag maintainability risks that likely amplify defects over time."
          ],
          "expected_evidence": [
            "Finding candidates tagged dead-end/slop.",
            "Noted hotspots for complexity or duplication."
          ],
          "done_when": [
            "Maintainability findings are concrete and prioritized."
          ]
        },
        {
          "id": "S06",
          "title": "Triage pass: Severity and impact classification",
          "actions": [
            "Consolidate findings and assign severity by impact and confidence.",
            "Deduplicate overlapping findings while preserving evidence."
          ],
          "expected_evidence": [
            "Severity-sorted finding ledger.",
            "Deduped issue set with no contradictory entries."
          ],
          "done_when": [
            "Findings are ordered and ready for stakeholder consumption."
          ]
        },
        {
          "id": "S07",
          "title": "Quality gate: Contract and safety checks",
          "actions": [
            "Cross-check acceptance criteria and ensure report output contract is satisfied.",
            "Ensure no secret/raw sensitive values are exposed in findings text."
          ],
          "expected_evidence": [
            "Acceptance criteria coverage checklist.",
            "Redaction/safety confirmation note."
          ],
          "done_when": [
            "Report is contract-compliant and safe to persist."
          ]
        },
        {
          "id": "S08",
          "title": "Finalize report for iterative handoff",
          "actions": [
            "Publish concise context, method, findings, risks, and next-step signals.",
            "Ensure output can feed directly into subsequent linting/fixing stories."
          ],
          "expected_evidence": [
            "Deterministic markdown report body.",
            "Clear transition notes for next iteration."
          ],
          "done_when": [
            "Report is complete and iteration-ready."
          ]
        }
      ],
      "verification": [
        "Findings are evidence-backed with concrete paths and line anchors where possible.",
        "Broken-logic, unfinished/stub, dead-end/slop, and will-break categories were checked explicitly.",
        "Severity ordering is explicit and auditable.",
        "No repository modifications were performed."
      ],
      "out_of_scope": [
        "Editing repository files.",
        "Behavior-changing implementation work.",
        "Speculative claims without evidence."
      ]
    },
    {
      "id": "AUDIT-002",
      "title": "Documentation And Onboarding Coverage Review",
      "priority": 2,
      "mode": "audit",
      "scope": [
        "README*",
        "**/*.md",
        "docs/**"
      ],
      "acceptance_criteria": [
        "Created .codex/ralph-audit/audit/AUDIT-002-docs-onboarding-review.md with documentation findings",
        "Report identifies missing, stale, or conflicting guidance",
        "Report prioritizes gaps by operational impact"
      ],
      "passes": false,
      "notes": "Passive audit only. No edits. Detailed execution plan is defined via objective/steps/verification/out_of_scope.",
      "objective": "Run an iterative, evidence-first deep audit for 'Documentation And Onboarding Coverage Review' using small scan passes and severity-based triage.",
      "steps": [
        {
          "id": "S01",
          "title": "Preflight: Scope and boundaries",
          "actions": [
            "Confirm active story AUDIT-002 and repository-relative scope boundaries.",
            "Limit inspection strictly to: README*, **/*.md, docs/**."
          ],
          "expected_evidence": [
            "Scope-boundary statement in report method section.",
            "List of included/excluded areas for this pass."
          ],
          "done_when": [
            "Audit boundary is explicit and reproducible."
          ]
        },
        {
          "id": "S02",
          "title": "Inventory pass: Files and entry points",
          "actions": [
            "Enumerate files/dirs inside scope and identify operationally relevant entry points.",
            "Record unknown or high-risk zones that require deeper scan attention."
          ],
          "expected_evidence": [
            "Path-indexed inventory snapshot.",
            "Unknown/high-risk zone shortlist."
          ],
          "done_when": [
            "High-signal inspection targets are clearly identified."
          ]
        },
        {
          "id": "S03",
          "title": "Deep scan pass A: Broken logic and will-break patterns",
          "actions": [
            "Inspect docs for conflicting onboarding commands and outdated setup guidance.",
            "Capture breakpoints where newcomers/operators are likely to fail."
          ],
          "expected_evidence": [
            "Finding candidates tagged as broken-logic/will-break.",
            "Evidence references with file paths and lines where possible."
          ],
          "done_when": [
            "All high-risk logic defects are captured or explicitly ruled out."
          ]
        },
        {
          "id": "S04",
          "title": "Deep scan pass B: Unfinished, stubs, skeleton code",
          "actions": [
            "Look for TODO/FIXME/HACK markers, placeholders, partial implementations, and fake/stub responses.",
            "Record incomplete behavior and latent feature gaps."
          ],
          "expected_evidence": [
            "Finding candidates tagged unfinished/stub/skeleton.",
            "Examples with code-location context."
          ],
          "done_when": [